{
    "ignore": ["**/*.txt", "sub_directory/sub_sub_directory_to_ignore"],
    "license": "LICENSE",
    "licenseFormats": {
        "js": {
            "prepend": "/*",
            "append": " */",
            "eachLine": {
                "prepend": " * "
            }
        },
        "dotfile": {
            "eachLine": {
                "prepend": "# "
            }
        }
    },
    "trailingWhitespace": "TRIM"
}